{"version":"1.0","campaign_id":"playboy-towel-p1p2-v1","plan_revision":1,"target_count":300,"pilot_count":60,"status":"draft","fact_snapshot_refs":["fact-p1-v1","fact-p2-v1"],"wave_refs":[],"slots":[{"content_slot_id":"P1-A01","week":1,"direction_id":"test_selection","structure_id":"P1","support_type":"experiment","sku":"yb-bb-03","product_id":"1060430166297","item_code":"yb-bb-03","fact_snapshot_ref":"fact-p1-v1","recipe_id":"P1-A01-recipe-v1","content_version_id":"P1-A01-v001","source_group":"A","source_angle":"实物身份与全貌","changed_variable":"首帧：平铺/手持","claim_mode":"merchant_page_claim","required_evidence":["product_full_view"],"status":"planned"},{"content_slot_id":"P1-A02","week":1,"direction_id":"test_selection","structure_id":"P1","support_type":"experiment","sku":"yb-bb-03","product_id":"1060430166297","item_code":"yb-bb-03","fact_snapshot_ref":"fact-p1-v1","recipe_id":"P1-A02-recipe-v1","content_version_id":"P1-A02-v001","source_group":"A","source_angle":"颜色与组合选择","changed_variable":"只换颜色","claim_mode":"screen_visible","required_evidence":["sku_color_options"],"status":"planned"},{"content_slot_id":"P1-A03","week":1,"direction_id":"test_selection","structure_id":"P1","support_type":"experiment","sku":"yb-bb-03","product_id":"1060430166297","item_code":"yb-bb-03","fact_snapshot_ref":"fact-p1-v1","recipe_id":"P1-A03-recipe-v1","content_version_id":"P1-A03-v001","source_group":"A","source_angle":"织纹与双面毛圈","changed_variable":"微距距离","claim_mode":"physical_evidence","required_evidence":["weave_macro"],"status":"planned"},{"content_slot_id":"P1-A04","week":1,"direction_id":"test_selection","structure_id":"P1","support_type":"experiment","sku":"yb-bb-03","product_id":"1060430166297","item_code":"yb-bb-03","fact_snapshot_ref":"fact-p1-v1","recipe_id":"P1-A04-recipe-v1","content_version_id":"P1-A04-v001","source_group":"A","source_angle":"边缘、标签和做工","changed_variable":"机位和字幕密度","claim_mode":"physical_evidence","required_evidence":["edge_label"],"status":"planned"},{"content_slot_id":"P1-A05","week":1,"direction_id":"test_selection","structure_id":"P1","support_type":"experiment","sku":"yb-bb-03","product_id":"1060430166297","item_code":"yb-bb-03","fact_snapshot_ref":"fact-p1-v1","recipe_id":"P1-A05-recipe-v1","content_version_id":"P1-A05-v001","source_group":"A","source_angle":"展开、折叠与收纳","changed_variable":"展开先行/折叠先行","claim_mode":"physical_evidence","required_evidence":["fold_storage"],"status":"planned"},{"content_slot_id":"P1-A06","week":1,"direction_id":"test_selection","structure_id":"P1","support_type":"experiment","sku":"yb-bb-03","product_id":"1060430166297","item_code":"yb-bb-03","fact_snapshot_ref":"fact-p1-v1","recipe_id":"P1-A06-recipe-v1","content_version_id":"P1-A06-v001","source_group":"A","source_angle":"挂放与空间占位","changed_variable":"浴室/洗手台","claim_mode":"physical_evidence","required_evidence":["hang_space"],"status":"planned"},{"content_slot_id":"P1-A07","week":1,"direction_id":"test_selection","structure_id":"P1","support_type":"experiment","sku":"yb-bb-03","product_id":"1060430166297","item_code":"yb-bb-03","fact_snapshot_ref":"fact-p1-v1","recipe_id":"P1-A07-recipe-v1","content_version_id":"P1-A07-v001","source_group":"A","source_angle":"页面参数清单","changed_variable":"逐项/一次出现","claim_mode":"merchant_page_claim","required_evidence":["page_params_snapshot"],"status":"planned"},{"content_slot_id":"P1-A08","week":1,"direction_id":"test_selection","structure_id":"P1","support_type":"experiment","sku":"yb-bb-03","product_id":"1060430166297","item_code":"yb-bb-03","fact_snapshot_ref":"fact-p1-v1","recipe_id":"P1-A08-recipe-v1","content_version_id":"P1-A08-v001","source_group":"A","source_angle":"规格选项怎么选","changed_variable":"单条/组合装","claim_mode":"screen_visible","required_evidence":["sku_options"],"status":"planned"},{"content_slot_id":"P1-A09","week":2,"direction_id":"test_selection","structure_id":"P1","support_type":"experiment","sku":"yb-bb-03","product_id":"1060430166297","item_code":"yb-bb-03","fact_snapshot_ref":"fact-p1-v1","recipe_id":"P1-A09-recipe-v1","content_version_id":"P1-A09-v001","source_group":"A","source_angle":"页面厚度字段","changed_variable":"P1加厚款/P2标准款","claim_mode":"merchant_page_claim","required_evidence":["thickness_field"],"status":"planned"},{"content_slot_id":"P1-A10","week":2,"direction_id":"test_selection","structure_id":"P1","support_type":"experiment","sku":"yb-bb-03","product_id":"1060430166297","item_code":"yb-bb-03","fact_snapshot_ref":"fact-p1-v1","recipe_id":"P1-A10-recipe-v1","content_version_id":"P1-A10-v001","source_group":"A","source_angle":"购买前检查表","changed_variable":"材质/棉含量/货号/颜色","claim_mode":"merchant_page_claim","required_evidence":["page_fact_card"],"status":"planned"},{"content_slot_id":"P1-A11","week":2,"direction_id":"test_selection","structure_id":"P1","support_type":"experiment","sku":"yb-bb-03","product_id":"1060430166297","item_code":"yb-bb-03","fact_snapshot_ref":"fact-p1-v1","recipe_id":"P1-A11-recipe-v1","content_version_id":"P1-A11-v001","source_group":"A","source_angle":"页面宣称与证据边界","changed_variable":"页面写了什么/还要核对什么","claim_mode":"claim_boundary","required_evidence":["claim_evidence_map"],"status":"planned"},{"content_slot_id":"P1-A12","week":2,"direction_id":"test_selection","structure_id":"P1","support_type":"experiment","sku":"yb-bb-03","product_id":"1060430166297","item_code":"yb-bb-03","fact_snapshot_ref":"fact-p1-v1","recipe_id":"P1-A12-recipe-v1","content_version_id":"P1-A12-v001","source_group":"A","source_angle":"商品页承接","changed_variable":"查看规格/颜色/商品页","claim_mode":"screen_visible","required_evidence":["product_page_link"],"status":"planned"},{"content_slot_id":"P1-B01","week":2,"direction_id":"healing_ritual","structure_id":"P2","support_type":"trust","sku":"yb-bb-03","product_id":"1060430166297","item_code":"yb-bb-03","fact_snapshot_ref":"fact-p1-v1","recipe_id":"P1-B01-recipe-v1","content_version_id":"P1-B01-v001","source_group":"B","source_angle":"洗手后擦干并挂回","changed_variable":"动作节奏","claim_mode":"physical_evidence","required_evidence":["real_use_action"],"status":"planned"},{"content_slot_id":"P1-B02","week":2,"direction_id":"healing_ritual","structure_id":"P2","support_type":"trust","sku":"yb-bb-03","product_id":"1060430166297","item_code":"yb-bb-03","fact_snapshot_ref":"fact-p1-v1","recipe_id":"P1-B02-recipe-v1","content_version_id":"P1-B02-v001","source_group":"B","source_angle":"洗澡后整理洗手台","changed_variable":"空间变化","claim_mode":"physical_evidence","required_evidence":["real_use_action"],"status":"planned"},{"content_slot_id":"P1-B03","week":2,"direction_id":"healing_ritual","structure_id":"P2","support_type":"trust","sku":"yb-bb-03","product_id":"1060430166297","item_code":"yb-bb-03","fact_snapshot_ref":"fact-p1-v1","recipe_id":"P1-B03-recipe-v1","content_version_id":"P1-B03-v001","source_group":"B","source_angle":"睡前整理","changed_variable":"安静生活感","claim_mode":"physical_evidence","required_evidence":["real_use_action"],"status":"planned"},{"content_slot_id":"P1-B04","week":3,"direction_id":"relationship_story","structure_id":"P3","support_type":"trust","sku":"yb-bb-03","product_id":"1060430166297","item_code":"yb-bb-03","fact_snapshot_ref":"fact-p1-v1","recipe_id":"P1-B04-recipe-v1","content_version_id":"P1-B04-v001","source_group":"B","source_angle":"来客前准备独立挂位","changed_variable":"关系场景","claim_mode":"physical_evidence","required_evidence":["real_use_action"],"status":"planned"},{"content_slot_id":"P1-B05","week":3,"direction_id":"relationship_story","structure_id":"P3","support_type":"trust","sku":"yb-bb-03","product_id":"1060430166297","item_code":"yb-bb-03","fact_snapshot_ref":"fact-p1-v1","recipe_id":"P1-B05-recipe-v1","content_version_id":"P1-B05-v001","source_group":"B","source_angle":"家庭成员颜色区分","changed_variable":"只谈颜色分区","claim_mode":"screen_visible","required_evidence":["sku_color_options"],"status":"planned"},{"content_slot_id":"P1-B06","week":3,"direction_id":"healing_ritual","structure_id":"P2","support_type":"trust","sku":"yb-bb-03","product_id":"1060430166297","item_code":"yb-bb-03","fact_snapshot_ref":"fact-p1-v1","recipe_id":"P1-B06-recipe-v1","content_version_id":"P1-B06-v001","source_group":"B","source_angle":"早晨出门前使用","changed_variable":"快速动作","claim_mode":"physical_evidence","required_evidence":["real_use_action"],"status":"planned"},{"content_slot_id":"P1-B07","week":3,"direction_id":"healing_ritual","structure_id":"P2","support_type":"trust","sku":"yb-bb-03","product_id":"1060430166297","item_code":"yb-bb-03","fact_snapshot_ref":"fact-p1-v1","recipe_id":"P1-B07-recipe-v1","content_version_id":"P1-B07-v001","source_group":"B","source_angle":"使用后折叠收纳","changed_variable":"真实收纳结果","claim_mode":"physical_evidence","required_evidence":["fold_storage"],"status":"planned"},{"content_slot_id":"P1-B08","week":3,"direction_id":"healing_ritual","structure_id":"P2","support_type":"trust","sku":"yb-bb-03","product_id":"1060430166297","item_code":"yb-bb-03","fact_snapshot_ref":"fact-p1-v1","recipe_id":"P1-B08-recipe-v1","content_version_id":"P1-B08-v001","source_group":"B","source_angle":"一天结束后的浴室复位","changed_variable":"前后对照","claim_mode":"physical_evidence","required_evidence":["real_use_action"],"status":"planned"},{"content_slot_id":"P1-C01","week":3,"direction_id":"comment_faq","structure_id":"P6","support_type":"faq","sku":"yb-bb-03","product_id":"1060430166297","item_code":"yb-bb-03","fact_snapshot_ref":"fact-p1-v1","recipe_id":"P1-C01-recipe-v1","content_version_id":"P1-C01-v001","source_group":"C","source_angle":"抗菌或长绒棉如何核验","changed_variable":"页面宣称/证据提示","claim_mode":"claim_boundary","required_evidence":["claim_evidence_map"],"status":"planned"},{"content_slot_id":"P1-C02","week":3,"direction_id":"comment_faq","structure_id":"P6","support_type":"faq","sku":"yb-bb-03","product_id":"1060430166297","item_code":"yb-bb-03","fact_snapshot_ref":"fact-p1-v1","recipe_id":"P1-C02-recipe-v1","content_version_id":"P1-C02-v001","source_group":"C","source_angle":"吸水性字段怎么理解","changed_variable":"页面5-10秒/实测另立","claim_mode":"merchant_page_c